{
  "titolo": "Tolleranza: 3 × 150 m",
  "vasca_metri": 25,
  "durata_stimata_min": 43,
  "blocchi": [
    {
      "tipo": "riscaldamento",
      "serie": [
        {
          "ripetizioni": 2,
          "distanza_m": 100,
          "stile": "libero",
          "intensita": "facile",
          "recupero_s": 15
        }
      ]
    },
    {
      "tipo": "tecnica",
      "serie": [
        {
          "ripetizioni": 6,
          "distanza_m": 50,
          "stile": "rana",
          "drill": "rana-due-gambate-una-bracciata",
          "recupero_s": 25
        }
      ]
    },
    {
      "tipo": "principale",
      "serie": [
        {
          "ripetizioni": 3,
          "distanza_m": 150,
          "stile": "libero",
          "intensita": "forte",
          "recupero_s": 60
        }
      ]
    },
    {
      "tipo": "defaticamento",
      "serie": [
        {
          "ripetizioni": 2,
          "distanza_m": 100,
          "stile": "libero",
          "intensita": "facile",
          "recupero_s": 15
        }
      ]
    }
  ]
}
