{
  "titolo": "Fondo facile: 3 × 50 m + 4 × 50 m",
  "vasca_metri": 25,
  "durata_stimata_min": 34,
  "blocchi": [
    {
      "tipo": "riscaldamento",
      "serie": [
        {
          "ripetizioni": 2,
          "distanza_m": 50,
          "stile": "libero",
          "intensita": "facile",
          "recupero_s": 20
        }
      ]
    },
    {
      "tipo": "tecnica",
      "serie": [
        {
          "ripetizioni": 4,
          "distanza_m": 25,
          "stile": "libero",
          "drill": "catch-up",
          "recupero_s": 20
        }
      ]
    },
    {
      "tipo": "principale",
      "serie": [
        {
          "ripetizioni": 3,
          "distanza_m": 50,
          "stile": "libero",
          "intensita": "facile",
          "recupero_s": 30
        },
        {
          "ripetizioni": 4,
          "distanza_m": 50,
          "stile": "libero",
          "intensita": "media",
          "recupero_s": 35
        }
      ]
    },
    {
      "tipo": "defaticamento",
      "serie": [
        {
          "ripetizioni": 1,
          "distanza_m": 25,
          "stile": "libero",
          "intensita": "facile"
        }
      ]
    }
  ]
}
