{
  "titolo": "Tolleranza: 4 × 100 m · 950 m",
  "vasca_metri": 25,
  "durata_stimata_min": 38,
  "blocchi": [
    {
      "tipo": "riscaldamento",
      "serie": [
        {
          "ripetizioni": 1,
          "distanza_m": 200,
          "stile": "libero",
          "intensita": "facile"
        }
      ]
    },
    {
      "tipo": "tecnica",
      "serie": [
        {
          "ripetizioni": 6,
          "distanza_m": 25,
          "stile": "libero",
          "drill": "un-braccio-solo",
          "recupero_s": 25
        }
      ]
    },
    {
      "tipo": "principale",
      "serie": [
        {
          "ripetizioni": 4,
          "distanza_m": 100,
          "stile": "libero",
          "intensita": "forte",
          "recupero_s": 60
        }
      ]
    },
    {
      "tipo": "defaticamento",
      "serie": [
        {
          "ripetizioni": 1,
          "distanza_m": 200,
          "stile": "libero",
          "intensita": "facile"
        }
      ]
    }
  ]
}
