{
  "titolo": "Tecnica: dorso un braccio alla volta e nuotata con pull buoy",
  "vasca_metri": 25,
  "durata_stimata_min": 42,
  "blocchi": [
    {
      "tipo": "riscaldamento",
      "serie": [
        {
          "ripetizioni": 1,
          "distanza_m": 200,
          "stile": "libero",
          "intensita": "facile"
        }
      ]
    },
    {
      "tipo": "tecnica",
      "serie": [
        {
          "ripetizioni": 4,
          "distanza_m": 25,
          "stile": "dorso",
          "drill": "dorso-un-braccio-alla-volta",
          "recupero_s": 25
        },
        {
          "ripetizioni": 6,
          "distanza_m": 25,
          "stile": "libero",
          "drill": "nuotata-con-pull-buoy",
          "recupero_s": 15
        }
      ]
    },
    {
      "tipo": "principale",
      "serie": [
        {
          "ripetizioni": 3,
          "distanza_m": 150,
          "stile": "libero",
          "intensita": "facile",
          "recupero_s": 20
        }
      ]
    },
    {
      "tipo": "defaticamento",
      "serie": [
        {
          "ripetizioni": 1,
          "distanza_m": 200,
          "stile": "libero",
          "intensita": "facile"
        }
      ]
    }
  ]
}
