{
  "titolo": "Fondo: 3 × 200 m · 1050 m",
  "vasca_metri": 25,
  "durata_stimata_min": 40,
  "blocchi": [
    {
      "tipo": "riscaldamento",
      "serie": [
        {
          "ripetizioni": 4,
          "distanza_m": 50,
          "stile": "libero",
          "intensita": "facile",
          "recupero_s": 15
        }
      ]
    },
    {
      "tipo": "tecnica",
      "serie": [
        {
          "ripetizioni": 6,
          "distanza_m": 25,
          "stile": "dorso",
          "drill": "dorso-battuta-con-rotazione",
          "recupero_s": 25
        }
      ]
    },
    {
      "tipo": "principale",
      "serie": [
        {
          "ripetizioni": 3,
          "distanza_m": 200,
          "stile": "libero",
          "intensita": "media",
          "recupero_s": 25
        }
      ]
    },
    {
      "tipo": "defaticamento",
      "serie": [
        {
          "ripetizioni": 2,
          "distanza_m": 50,
          "stile": "libero",
          "intensita": "facile",
          "recupero_s": 15
        }
      ]
    }
  ]
}
