{
  "titolo": "Soglia: 10 × 50 m · 1150 m",
  "vasca_metri": 25,
  "durata_stimata_min": 44,
  "blocchi": [
    {
      "tipo": "riscaldamento",
      "serie": [
        {
          "ripetizioni": 1,
          "distanza_m": 200,
          "stile": "libero",
          "intensita": "facile"
        }
      ]
    },
    {
      "tipo": "tecnica",
      "serie": [
        {
          "ripetizioni": 4,
          "distanza_m": 50,
          "stile": "libero",
          "drill": "dita-sull-acqua",
          "recupero_s": 25
        },
        {
          "ripetizioni": 6,
          "distanza_m": 25,
          "stile": "libero",
          "drill": "battuta-con-un-braccio-teso",
          "recupero_s": 20
        }
      ]
    },
    {
      "tipo": "principale",
      "serie": [
        {
          "ripetizioni": 10,
          "distanza_m": 50,
          "stile": "libero",
          "intensita": "media",
          "recupero_s": 15
        }
      ]
    },
    {
      "tipo": "defaticamento",
      "serie": [
        {
          "ripetizioni": 1,
          "distanza_m": 100,
          "stile": "libero",
          "intensita": "facile"
        }
      ]
    }
  ]
}
