{
  "titolo": "Ritmo alto: 4 × 100 m + 6 × 50 m",
  "vasca_metri": 25,
  "durata_stimata_min": 44,
  "blocchi": [
    {
      "tipo": "riscaldamento",
      "serie": [
        {
          "ripetizioni": 2,
          "distanza_m": 100,
          "stile": "libero",
          "intensita": "facile",
          "recupero_s": 15
        }
      ]
    },
    {
      "tipo": "tecnica",
      "serie": [
        {
          "ripetizioni": 4,
          "distanza_m": 25,
          "stile": "rana",
          "drill": "rana-con-scivolo",
          "recupero_s": 20
        }
      ]
    },
    {
      "tipo": "principale",
      "serie": [
        {
          "ripetizioni": 4,
          "distanza_m": 100,
          "stile": "libero",
          "intensita": "forte",
          "recupero_s": 45
        },
        {
          "ripetizioni": 6,
          "distanza_m": 50,
          "stile": "libero",
          "intensita": "forte",
          "recupero_s": 30
        }
      ]
    },
    {
      "tipo": "defaticamento",
      "serie": [
        {
          "ripetizioni": 1,
          "distanza_m": 200,
          "stile": "libero",
          "intensita": "facile"
        }
      ]
    }
  ]
}
