{
  "titolo": "Soglia: 8 × 50 m · 1000 m",
  "vasca_metri": 25,
  "durata_stimata_min": 39,
  "blocchi": [
    {
      "tipo": "riscaldamento",
      "serie": [
        {
          "ripetizioni": 1,
          "distanza_m": 200,
          "stile": "libero",
          "intensita": "facile"
        }
      ]
    },
    {
      "tipo": "tecnica",
      "serie": [
        {
          "ripetizioni": 6,
          "distanza_m": 50,
          "stile": "rana",
          "drill": "rana-due-gambate-una-bracciata",
          "recupero_s": 25
        }
      ]
    },
    {
      "tipo": "principale",
      "serie": [
        {
          "ripetizioni": 8,
          "distanza_m": 50,
          "stile": "libero",
          "intensita": "media",
          "recupero_s": 15
        }
      ]
    },
    {
      "tipo": "defaticamento",
      "serie": [
        {
          "ripetizioni": 2,
          "distanza_m": 50,
          "stile": "libero",
          "intensita": "facile",
          "recupero_s": 15
        }
      ]
    }
  ]
}
