{
  "titolo": "Soglia: 8 × 50 m · 1050 m",
  "vasca_metri": 25,
  "durata_stimata_min": 43,
  "blocchi": [
    {
      "tipo": "riscaldamento",
      "serie": [
        {
          "ripetizioni": 4,
          "distanza_m": 50,
          "stile": "libero",
          "intensita": "facile",
          "recupero_s": 15
        }
      ]
    },
    {
      "tipo": "tecnica",
      "serie": [
        {
          "ripetizioni": 6,
          "distanza_m": 25,
          "stile": "libero",
          "drill": "sei-colpi-e-cambio",
          "recupero_s": 25
        },
        {
          "ripetizioni": 4,
          "distanza_m": 25,
          "stile": "libero",
          "drill": "respirazione-laterale-con-tavoletta",
          "recupero_s": 20
        }
      ]
    },
    {
      "tipo": "principale",
      "serie": [
        {
          "ripetizioni": 8,
          "distanza_m": 50,
          "stile": "libero",
          "intensita": "media",
          "recupero_s": 15
        }
      ]
    },
    {
      "tipo": "defaticamento",
      "serie": [
        {
          "ripetizioni": 1,
          "distanza_m": 200,
          "stile": "libero",
          "intensita": "facile"
        }
      ]
    }
  ]
}
