{
  "titolo": "Tecnica: battuta con tavoletta",
  "vasca_metri": 25,
  "durata_stimata_min": 32,
  "blocchi": [
    {
      "tipo": "riscaldamento",
      "serie": [
        {
          "ripetizioni": 1,
          "distanza_m": 100,
          "stile": "libero",
          "intensita": "facile"
        }
      ]
    },
    {
      "tipo": "tecnica",
      "serie": [
        {
          "ripetizioni": 4,
          "distanza_m": 25,
          "stile": "libero",
          "drill": "battuta-con-tavoletta",
          "recupero_s": 20
        }
      ]
    },
    {
      "tipo": "principale",
      "serie": [
        {
          "ripetizioni": 6,
          "distanza_m": 50,
          "stile": "libero",
          "intensita": "facile",
          "recupero_s": 35
        }
      ]
    },
    {
      "tipo": "defaticamento",
      "serie": [
        {
          "ripetizioni": 1,
          "distanza_m": 25,
          "stile": "libero",
          "intensita": "facile"
        }
      ]
    }
  ]
}
