{
  "titolo": "Fondo: 2 × 300 m",
  "vasca_metri": 25,
  "durata_stimata_min": 40,
  "blocchi": [
    {
      "tipo": "riscaldamento",
      "serie": [
        {
          "ripetizioni": 4,
          "distanza_m": 50,
          "stile": "libero",
          "intensita": "facile",
          "recupero_s": 15
        }
      ]
    },
    {
      "tipo": "tecnica",
      "serie": [
        {
          "ripetizioni": 4,
          "distanza_m": 50,
          "stile": "dorso",
          "drill": "battuta-sul-dorso",
          "recupero_s": 20
        }
      ]
    },
    {
      "tipo": "principale",
      "serie": [
        {
          "ripetizioni": 2,
          "distanza_m": 300,
          "stile": "libero",
          "intensita": "media",
          "recupero_s": 25
        }
      ]
    },
    {
      "tipo": "defaticamento",
      "serie": [
        {
          "ripetizioni": 2,
          "distanza_m": 50,
          "stile": "libero",
          "intensita": "facile",
          "recupero_s": 15
        }
      ]
    }
  ]
}
