{
  "titolo": "Ritmo alto: 10 × 50 m · 1000 m",
  "vasca_metri": 25,
  "durata_stimata_min": 40,
  "blocchi": [
    {
      "tipo": "riscaldamento",
      "serie": [
        {
          "ripetizioni": 2,
          "distanza_m": 100,
          "stile": "libero",
          "intensita": "facile",
          "recupero_s": 15
        }
      ]
    },
    {
      "tipo": "tecnica",
      "serie": [
        {
          "ripetizioni": 4,
          "distanza_m": 50,
          "stile": "delfino",
          "drill": "delfino-un-braccio-alla-volta",
          "recupero_s": 25
        }
      ]
    },
    {
      "tipo": "principale",
      "serie": [
        {
          "ripetizioni": 10,
          "distanza_m": 50,
          "stile": "libero",
          "intensita": "forte",
          "recupero_s": 30
        }
      ]
    },
    {
      "tipo": "defaticamento",
      "serie": [
        {
          "ripetizioni": 2,
          "distanza_m": 50,
          "stile": "libero",
          "intensita": "facile",
          "recupero_s": 15
        }
      ]
    }
  ]
}
