{
  "titolo": "Fondo: 6 × 100 m · 1200 m",
  "vasca_metri": 25,
  "durata_stimata_min": 45,
  "blocchi": [
    {
      "tipo": "riscaldamento",
      "serie": [
        {
          "ripetizioni": 6,
          "distanza_m": 50,
          "stile": "libero",
          "intensita": "facile",
          "recupero_s": 15
        }
      ]
    },
    {
      "tipo": "tecnica",
      "serie": [
        {
          "ripetizioni": 4,
          "distanza_m": 25,
          "stile": "dorso",
          "drill": "battuta-sul-dorso",
          "recupero_s": 25
        },
        {
          "ripetizioni": 4,
          "distanza_m": 25,
          "stile": "delfino",
          "drill": "delfino-un-braccio-alla-volta",
          "recupero_s": 25
        }
      ]
    },
    {
      "tipo": "principale",
      "serie": [
        {
          "ripetizioni": 6,
          "distanza_m": 100,
          "stile": "libero",
          "intensita": "media",
          "recupero_s": 15
        }
      ]
    },
    {
      "tipo": "defaticamento",
      "serie": [
        {
          "ripetizioni": 1,
          "distanza_m": 100,
          "stile": "libero",
          "intensita": "facile"
        }
      ]
    }
  ]
}
