{
  "titolo": "Soglia: 8 × 50 m · 1200 m · variante 3",
  "vasca_metri": 25,
  "durata_stimata_min": 46,
  "blocchi": [
    {
      "tipo": "riscaldamento",
      "serie": [
        {
          "ripetizioni": 1,
          "distanza_m": 300,
          "stile": "libero",
          "intensita": "facile"
        }
      ]
    },
    {
      "tipo": "tecnica",
      "serie": [
        {
          "ripetizioni": 6,
          "distanza_m": 50,
          "stile": "rana",
          "drill": "rana-due-gambate-una-bracciata",
          "recupero_s": 20
        },
        {
          "ripetizioni": 4,
          "distanza_m": 25,
          "stile": "dorso",
          "drill": "dorso-un-braccio-alla-volta",
          "recupero_s": 20
        }
      ]
    },
    {
      "tipo": "principale",
      "serie": [
        {
          "ripetizioni": 8,
          "distanza_m": 50,
          "stile": "libero",
          "intensita": "media",
          "recupero_s": 15
        }
      ]
    },
    {
      "tipo": "defaticamento",
      "serie": [
        {
          "ripetizioni": 2,
          "distanza_m": 50,
          "stile": "libero",
          "intensita": "facile",
          "recupero_s": 15
        }
      ]
    }
  ]
}
