{
  "titolo": "Tecnica: battuta con un braccio teso",
  "vasca_metri": 25,
  "durata_stimata_min": 34,
  "blocchi": [
    {
      "tipo": "riscaldamento",
      "serie": [
        {
          "ripetizioni": 4,
          "distanza_m": 25,
          "stile": "libero",
          "intensita": "facile",
          "recupero_s": 20
        }
      ]
    },
    {
      "tipo": "tecnica",
      "serie": [
        {
          "ripetizioni": 4,
          "distanza_m": 25,
          "stile": "libero",
          "drill": "battuta-con-un-braccio-teso",
          "recupero_s": 25
        }
      ]
    },
    {
      "tipo": "principale",
      "serie": [
        {
          "ripetizioni": 10,
          "distanza_m": 25,
          "stile": "libero",
          "intensita": "facile",
          "recupero_s": 30
        }
      ]
    },
    {
      "tipo": "defaticamento",
      "serie": [
        {
          "ripetizioni": 1,
          "distanza_m": 50,
          "stile": "libero",
          "intensita": "facile"
        }
      ]
    }
  ]
}
