{
  "titolo": "Tolleranza: 6 × 50 m + 2 × 100 m",
  "vasca_metri": 25,
  "durata_stimata_min": 44,
  "blocchi": [
    {
      "tipo": "riscaldamento",
      "serie": [
        {
          "ripetizioni": 4,
          "distanza_m": 50,
          "stile": "libero",
          "intensita": "facile",
          "recupero_s": 15
        }
      ]
    },
    {
      "tipo": "tecnica",
      "serie": [
        {
          "ripetizioni": 6,
          "distanza_m": 25,
          "stile": "dorso",
          "drill": "battuta-sul-dorso",
          "recupero_s": 20
        },
        {
          "ripetizioni": 4,
          "distanza_m": 25,
          "stile": "libero",
          "drill": "sei-colpi-e-cambio",
          "recupero_s": 20
        }
      ]
    },
    {
      "tipo": "principale",
      "serie": [
        {
          "ripetizioni": 6,
          "distanza_m": 50,
          "stile": "libero",
          "intensita": "forte",
          "recupero_s": 40
        },
        {
          "ripetizioni": 2,
          "distanza_m": 100,
          "stile": "libero",
          "intensita": "forte",
          "recupero_s": 60
        }
      ]
    },
    {
      "tipo": "defaticamento",
      "serie": [
        {
          "ripetizioni": 1,
          "distanza_m": 100,
          "stile": "libero",
          "intensita": "facile"
        }
      ]
    }
  ]
}
