{
  "titolo": "Resistenza intermedia",
  "vasca_metri": 25,
  "durata_stimata_min": 35,
  "blocchi": [
    { "tipo": "riscaldamento", "serie": [
      { "ripetizioni": 4, "distanza_m": 50, "stile": "libero", "intensita": "facile", "recupero_s": 15 } ] },
    { "tipo": "tecnica", "serie": [
      { "ripetizioni": 4, "distanza_m": 50, "stile": "libero", "drill": "un-braccio-solo", "recupero_s": 20 } ] },
    { "tipo": "principale", "serie": [
      { "ripetizioni": 3, "distanza_m": 100, "stile": "libero", "intensita": "media", "recupero_s": 30 } ] },
    { "tipo": "defaticamento", "serie": [
      { "ripetizioni": 1, "distanza_m": 100, "stile": "libero", "intensita": "facile" } ] }
  ]
}
