{
  "titolo": "Fondo: 3 × 200 m · 1100 m · variante 2",
  "vasca_metri": 25,
  "durata_stimata_min": 39,
  "blocchi": [
    {
      "tipo": "riscaldamento",
      "serie": [
        {
          "ripetizioni": 4,
          "distanza_m": 50,
          "stile": "libero",
          "intensita": "facile",
          "recupero_s": 15
        }
      ]
    },
    {
      "tipo": "tecnica",
      "serie": [
        {
          "ripetizioni": 4,
          "distanza_m": 25,
          "stile": "rana",
          "drill": "rana-con-scivolo",
          "recupero_s": 15
        }
      ]
    },
    {
      "tipo": "principale",
      "serie": [
        {
          "ripetizioni": 3,
          "distanza_m": 200,
          "stile": "libero",
          "intensita": "media",
          "recupero_s": 30
        }
      ]
    },
    {
      "tipo": "defaticamento",
      "serie": [
        {
          "ripetizioni": 1,
          "distanza_m": 200,
          "stile": "libero",
          "intensita": "facile"
        }
      ]
    }
  ]
}
